{
  "schema_version": "0.1",
  "generated_at": "2026-06-01T08:20:02.834588Z",
  "source_artifacts": {
    "table_io_pipelines": "/Users/kangmin/Documents/excel-workbook-editing/review-packages/workbook-understanding/mbp-2026-02-table-io-pipelines.json",
    "gate_execution": "/Users/kangmin/Documents/excel-workbook-editing/review-packages/workbook-understanding/mbp-2026-02-gate-execution.json",
    "boundary_decisions": "/Users/kangmin/Documents/excel-workbook-editing/review-packages/workbook-understanding/mbp-2026-02-boundary-decisions.json"
  },
  "method": {
    "name": "deterministic_pipeline_role_validation",
    "authority": "pipeline_role_decision_not_final_document_graph",
    "decision_policy": "Validate roles from formula signatures, pivot cache definitions, input/output refs, accepted boundary constraints, and gate contradictions. Missing visual capture is a review annotation unless it invalidates the role evidence."
  },
  "role_validations": [
    {
      "id": "role_validation_pipeline_결제_수수료_pivot_pivottable1",
      "type": "pipeline_role_validation",
      "pipeline_id": "pipeline_결제_수수료_pivot_pivottable1",
      "status": "accepted",
      "reason": "pivot_cache_report_role_supported",
      "confidence": 0.84,
      "asserted_role": "report",
      "validated_role": "report",
      "output_ref": {
        "id": "결제_수수료_pivot_pivottable1",
        "kind": "pivot_table",
        "sheet": "결제&수수료",
        "range": "A3:B10",
        "block_id": "결제_수수료_pivot_pivottable1",
        "region_id": null
      },
      "input_ref_count": 1,
      "transform_ref_count": 1,
      "role_evidence": [
        "input:cell_region",
        "output:pivot_table",
        "pivot_cache_transform",
        "review_required_boundary_constraint"
      ],
      "review_flags": [
        "pivot_cache_dependency"
      ],
      "blockers": [],
      "linked_gate_results": [
        {
          "id": "result_gate_target_결제_수수료_pivot_pivottable1_pivot_cache_visual_alignment",
          "gate_check_id": "gate_target_결제_수수료_pivot_pivottable1_pivot_cache_visual_alignment",
          "target_id": "target_결제_수수료_pivot_pivottable1",
          "gate_type": "pivot_cache_visual_alignment",
          "status": "review_required",
          "reason": "capture_required",
          "confidence": 0.25
        }
      ],
      "boundary_constraints": {
        "accepted_boundary_ids": [],
        "review_required_boundary_ids": [
          "boundary_decision_gate_split_결제상세_row_band_1_c25_c26",
          "boundary_decision_gate_split_결제상세_row_band_1_c38_c39",
          "boundary_decision_gate_split_결제상세_row_band_1_c41_c42",
          "boundary_decision_gate_split_결제상세_row_band_1_c47_c48",
          "boundary_decision_gate_split_결제상세_row_band_1_c4_c5"
        ],
        "rejected_boundary_ids": []
      },
      "evidence_refs": [
        "pipeline_결제_수수료_pivot_pivottable1",
        "rel_결제_수수료_pivot_pivottable1__pivot_cache_source",
        "result_gate_target_결제_수수료_pivot_pivottable1_pivot_cache_visual_alignment",
        "gate_target_결제_수수료_pivot_pivottable1_pivot_cache_visual_alignment",
        "boundary_decision_gate_split_결제상세_row_band_1_c25_c26",
        "boundary_decision_gate_split_결제상세_row_band_1_c38_c39",
        "boundary_decision_gate_split_결제상세_row_band_1_c41_c42",
        "boundary_decision_gate_split_결제상세_row_band_1_c47_c48",
        "boundary_decision_gate_split_결제상세_row_band_1_c4_c5"
      ],
      "notes": "report role accepted: pivot_cache_report_role_supported. Linked gates: pivot_cache_visual_alignment:review_required:capture_required=1"
    },
    {
      "id": "role_validation_pipeline_결제_수수료_pivot_피벗_테이블1",
      "type": "pipeline_role_validation",
      "pipeline_id": "pipeline_결제_수수료_pivot_피벗_테이블1",
      "status": "accepted",
      "reason": "pivot_cache_report_role_supported",
      "confidence": 0.84,
      "asserted_role": "report",
      "validated_role": "report",
      "output_ref": {
        "id": "결제_수수료_pivot_피벗_테이블1",
        "kind": "pivot_table",
        "sheet": "결제&수수료",
        "range": "A15:B33",
        "block_id": "결제_수수료_pivot_피벗_테이블1",
        "region_id": null
      },
      "input_ref_count": 1,
      "transform_ref_count": 1,
      "role_evidence": [
        "input:cell_region",
        "output:pivot_table",
        "pivot_cache_transform",
        "review_required_boundary_constraint"
      ],
      "review_flags": [
        "pivot_cache_dependency"
      ],
      "blockers": [],
      "linked_gate_results": [
        {
          "id": "result_gate_target_결제_수수료_pivot_피벗_테이블1_pivot_cache_visual_alignment",
          "gate_check_id": "gate_target_결제_수수료_pivot_피벗_테이블1_pivot_cache_visual_alignment",
          "target_id": "target_결제_수수료_pivot_피벗_테이블1",
          "gate_type": "pivot_cache_visual_alignment",
          "status": "review_required",
          "reason": "capture_required",
          "confidence": 0.25
        }
      ],
      "boundary_constraints": {
        "accepted_boundary_ids": [],
        "review_required_boundary_ids": [
          "boundary_decision_gate_split_결제상세_row_band_1_c25_c26",
          "boundary_decision_gate_split_결제상세_row_band_1_c38_c39",
          "boundary_decision_gate_split_결제상세_row_band_1_c41_c42",
          "boundary_decision_gate_split_결제상세_row_band_1_c47_c48",
          "boundary_decision_gate_split_결제상세_row_band_1_c4_c5"
        ],
        "rejected_boundary_ids": []
      },
      "evidence_refs": [
        "pipeline_결제_수수료_pivot_피벗_테이블1",
        "rel_결제_수수료_pivot_피벗_테이블1__pivot_cache_source",
        "result_gate_target_결제_수수료_pivot_피벗_테이블1_pivot_cache_visual_alignment",
        "gate_target_결제_수수료_pivot_피벗_테이블1_pivot_cache_visual_alignment",
        "boundary_decision_gate_split_결제상세_row_band_1_c25_c26",
        "boundary_decision_gate_split_결제상세_row_band_1_c38_c39",
        "boundary_decision_gate_split_결제상세_row_band_1_c41_c42",
        "boundary_decision_gate_split_결제상세_row_band_1_c47_c48",
        "boundary_decision_gate_split_결제상세_row_band_1_c4_c5"
      ],
      "notes": "report role accepted: pivot_cache_report_role_supported. Linked gates: pivot_cache_visual_alignment:review_required:capture_required=1"
    },
    {
      "id": "role_validation_pipeline_결제_수수료_pivot_피벗_테이블10",
      "type": "pipeline_role_validation",
      "pipeline_id": "pipeline_결제_수수료_pivot_피벗_테이블10",
      "status": "accepted",
      "reason": "pivot_cache_report_role_supported",
      "confidence": 0.84,
      "asserted_role": "report",
      "validated_role": "report",
      "output_ref": {
        "id": "결제_수수료_pivot_피벗_테이블10",
        "kind": "pivot_table",
        "sheet": "결제&수수료",
        "range": "A200:B203",
        "block_id": "결제_수수료_pivot_피벗_테이블10",
        "region_id": null
      },
      "input_ref_count": 1,
      "transform_ref_count": 1,
      "role_evidence": [
        "input:cell_region",
        "output:pivot_table",
        "pivot_cache_transform",
        "review_required_boundary_constraint"
      ],
      "review_flags": [
        "pivot_cache_dependency"
      ],
      "blockers": [],
      "linked_gate_results": [
        {
          "id": "result_gate_target_결제_수수료_pivot_피벗_테이블10_pivot_cache_visual_alignment",
          "gate_check_id": "gate_target_결제_수수료_pivot_피벗_테이블10_pivot_cache_visual_alignment",
          "target_id": "target_결제_수수료_pivot_피벗_테이블10",
          "gate_type": "pivot_cache_visual_alignment",
          "status": "review_required",
          "reason": "capture_required",
          "confidence": 0.25
        }
      ],
      "boundary_constraints": {
        "accepted_boundary_ids": [],
        "review_required_boundary_ids": [
          "boundary_decision_gate_split_결제상세_row_band_1_c25_c26",
          "boundary_decision_gate_split_결제상세_row_band_1_c38_c39",
          "boundary_decision_gate_split_결제상세_row_band_1_c41_c42",
          "boundary_decision_gate_split_결제상세_row_band_1_c47_c48",
          "boundary_decision_gate_split_결제상세_row_band_1_c4_c5"
        ],
        "rejected_boundary_ids": []
      },
      "evidence_refs": [
        "pipeline_결제_수수료_pivot_피벗_테이블10",
        "rel_결제_수수료_pivot_피벗_테이블10__pivot_cache_source",
        "result_gate_target_결제_수수료_pivot_피벗_테이블10_pivot_cache_visual_alignment",
        "gate_target_결제_수수료_pivot_피벗_테이블10_pivot_cache_visual_alignment",
        "boundary_decision_gate_split_결제상세_row_band_1_c25_c26",
        "boundary_decision_gate_split_결제상세_row_band_1_c38_c39",
        "boundary_decision_gate_split_결제상세_row_band_1_c41_c42",
        "boundary_decision_gate_split_결제상세_row_band_1_c47_c48",
        "boundary_decision_gate_split_결제상세_row_band_1_c4_c5"
      ],
      "notes": "report role accepted: pivot_cache_report_role_supported. Linked gates: pivot_cache_visual_alignment:review_required:capture_required=1"
    },
    {
      "id": "role_validation_pipeline_결제_수수료_pivot_피벗_테이블11",
      "type": "pipeline_role_validation",
      "pipeline_id": "pipeline_결제_수수료_pivot_피벗_테이블11",
      "status": "accepted",
      "reason": "pivot_cache_report_role_supported",
      "confidence": 0.84,
      "asserted_role": "report",
      "validated_role": "report",
      "output_ref": {
        "id": "결제_수수료_pivot_피벗_테이블11",
        "kind": "pivot_table",
        "sheet": "결제&수수료",
        "range": "A207:B210",
        "block_id": "결제_수수료_pivot_피벗_테이블11",
        "region_id": null
      },
      "input_ref_count": 1,
      "transform_ref_count": 1,
      "role_evidence": [
        "input:cell_region",
        "output:pivot_table",
        "pivot_cache_transform",
        "review_required_boundary_constraint"
      ],
      "review_flags": [
        "pivot_cache_dependency"
      ],
      "blockers": [],
      "linked_gate_results": [
        {
          "id": "result_gate_target_결제_수수료_pivot_피벗_테이블11_pivot_cache_visual_alignment",
          "gate_check_id": "gate_target_결제_수수료_pivot_피벗_테이블11_pivot_cache_visual_alignment",
          "target_id": "target_결제_수수료_pivot_피벗_테이블11",